headline,description,link,date
Hapag-Lloyd Acquires Minority Stake in India’s Leading Private Terminal Provider,German container shipping company Hapag-Lloyd has acquired a 40% stake in India’s leading private terminal and inland transport service provider J M Baxi,https://gcaptain.com/hapag-lloyd-acquires-minority-stake-in-indias-leading-private-terminal-provider/,"January 25, 2023"
Long Beach Port Chief Expects to Win Back Some Lost Cargo,"By Laura Curtis (Bloomberg) — The Port of Long Beach recorded its second-busiest year, despite a sharp drop in the second half as consumer demand eased",https://gcaptain.com/long-beach-port-chief-expects-to-win-back-some-lost-cargo/,"January 25, 2023"
‘Game Changer’: Nigeria Opens New Deep Sea Port in Lagos,"By Seun Sanni LAGOS, Jan 23 (Reuters) – Nigeria opened a billion-dollar Chinese-built deep seaport in Lagos on Monday, which is",https://gcaptain.com/game-changer-nigeria-opens-new-deep-sea-port-in-lagos/,"January 24, 2023"
West Coast Ports Bear the Brunt as Inbound Containers Drop Off,U.S. container ports experienced the largest contraction of inbound containers ever in the final months of 2022 as a slowdown in global trade continues to,https://gcaptain.com/west-coast-ports-bear-the-brunt-as-inbound-containers-drop-off/,"January 24, 2023"
Port of Charleston Sets Cargo Record in 2022,"The Port of Charleston handled a record 2.8 million TEUs in 2022, joining other East and Gulf Coast ports that also reported record cargo volumes in 2022.",https://gcaptain.com/port-of-charleston-sets-cargo-record-in-2022/,"January 24, 2023"
European Ports Brace for Slowdown as ‘Shopping Frenzy’ Ends,By Mike Wackett (The Loadstar) – North Europe’s container hub ports are bracing themselves for the weak January import volumes from Asia to continue,https://gcaptain.com/european-ports-brace-for-slowdown-as-shopping-frenzy-ends/,"January 24, 2023"
Powership Wants To Solve South Africa’s Electricity Crisis,"By Antony Sguazzin (Bloomberg) Karpowership, the Turkish company seeking to supply 1,220 megawatts of power to South Africa, will get a decision on its",https://gcaptain.com/powership-wants-to-solve-south-africas-electricity-crisis/,"January 21, 2023"
Port of Long Beach Falls Shy of Record in 2022 as Trade Slows,Cargo volumes at the Port of Long Beach fell just shy of 2021’s record last year as trade slowed in the second half of the year. The Port of,https://gcaptain.com/port-of-long-beach-falls-shy-of-record-in-2022-as-trade-slows/,"January 20, 2023"
Is Singapore Laundering Russian Crude?,"By Elizabeth Low (Bloomberg) Demand is soaring for oil storage tanks in Singapore, in a sign that a flood of Russian fuel is being blended and re-exported",https://gcaptain.com/is-singapore-laundering-russian-crude/,"January 19, 2023"
Port Houston Reports First Down Month of 2022 as it Closes Record Year,"Port Houston has closed out its best year on record in 2022 with 3.9 million TEUs handled. As the port reports, the figure is nearly double the volume posted",https://gcaptain.com/port-houston-reports-first-down-month-of-2022-as-it-closes-record-year/,"January 19, 2023"
US Truckers Warn Of Intermodal Weakness,"by Priyamvada C (Reuters) U.S. trucking firm J.B. Hunt Transport Services ($JBHT) quarterly results missed market expectations on Wednesday, hit by lower",https://gcaptain.com/us-truckers-warn-of-intermodal-weakness/,"January 18, 2023"
Major China Port Banks on Robots to Beat Post-Covid Disruptions,By Bloomberg News (Bloomberg) — One of the world’s biggest ports is working to fully automate all dock operations in a bid to cope with Covid-induced,https://gcaptain.com/major-china-port-banks-on-robots-to-beat-post-covid-disruptions/,"January 18, 2023"
Port of Savannah Cargo Volumes Hit Record 5.9 Million TEUs in 2022,"The Port of Savannah, billed as the fastest growing container terminal in the U.S., handled a record 5.9 million TEUs in 2022 for an increase of 5% over 2021,",https://gcaptain.com/port-of-savannah-cargo-volumes-hit-record-5-9-million-teus-in-2022/,"January 17, 2023"
Somalia Takes Back Key Port City,"By Abdiqani Hassan (Reuters) – Somalia’s government-led forces have captured an al Shabaab stronghold on the Indian Ocean coast, the defense",https://gcaptain.com/somalia-takes-back-key-port-city/,"January 16, 2023"
Singapore Bunker Fuel Sales Down 4.3%in 2022,"By Jeslyn Lerh SINGAPORE, Jan 13 (Reuters) – Sales of marine fuel in Singapore, including sales of liquefied natural gas and biofuels, fell",https://gcaptain.com/singapore-bunker-fuel-sales-down-4-3in-2022/,"January 13, 2023"
Port Houston Container Dwell Fee Set for February 1 Start,"Port Houston is moving ahead with its container dwell fee to help clear terminals of long-dwelling containers and improve cargo fluidity. The new fee, known as",https://gcaptain.com/port-houston-container-dwell-fee-set-for-february-1-start/,"January 3, 2023"
Ecuador Reports 400% Rise In Drug Trafficking Via Shipping Containers,"By Yury Garcia (Reuters) Insecurity in Ecuador is hurting the Andean country’s exports of products like bananas and shrimp, an exporters association",https://gcaptain.com/ecuador-reports-400-rise-in-drug-trafficking-via-shipping-containers/,"December 30, 2022"
Port of Long Beach Channel Deepening Project Wins Federal Authorization,"The Port of Long Beach’s $200 million channel deepening project has won federal authorization. The project promises to improve navigation and safety,",https://gcaptain.com/port-of-long-beach-channel-deepening-project-wins-federal-authorization/,"December 28, 2022"
Congestion Eases as Container Volumes Fall at Port of Oakland,The Port of Oakland reports that congestion has eased thanks to a big drop in November container volumes. Total loaded container volumes at the Port of Oakland,https://gcaptain.com/congestion-eases-as-container-volumes-fall-at-port-of-oakland/,"December 28, 2022"
Port of Long Beach Ending COVID-19 Vaccination Program for Seafarers,The Port of Long Beach said it is ending its COVID-19 vaccination program for seafarers working on ships calling in the San Pedro Bay after providing nearly,https://gcaptain.com/port-of-long-beach-ending-covid-19-vaccination-program-for-seafarers/,"December 28, 2022"
Container Dwell Times Return to Pre-Pandemic Levels at Los Angeles and Long Beach Ports,"Dwell times for local containers at the ports of Los Angeles and Long Beach have returned to pre-pandemic levels, reflecting improving congestion conditions",https://gcaptain.com/container-dwell-times-return-to-pre-pandemic-levels-at-los-angeles-and-long-beach-ports/,"December 27, 2022"
Port of New York and New Jersey Holds Lead as Busiest U.S. Port in November,The Port of New and New Jersey ranked as the busiest port in the United States for a fourth month in a row in November. The port reported handling,https://gcaptain.com/port-of-new-york-and-new-jersey-holds-lead-as-busiest-u-s-port-in-november/,"December 27, 2022"
ONE to Acquire Three U.S. West Coast Container Terminals,Japanese shipping company Ocean Network Express (ONE) has announced an agreement to acquire controlling stakes in three U.S. West Coast container terminals.,https://gcaptain.com/one-to-acquire-three-u-s-west-coast-container-terminals/,"December 27, 2022"
US Goods-Trade Deficit Narrows to Smallest in Nearly Two Years,By Ana Monteiro (Bloomberg) — The US merchandise-trade deficit narrowed in November to the smallest since December 2020 due to a plunge in imports. The,https://gcaptain.com/us-goods-trade-deficit-narrows-to-smallest-in-nearly-two-years/,"December 27, 2022"
Port of Long Beach Receives Credit Ratings Upgrade Amid Downturn,"The Port of Long Beach has received upgraded ratings from Standard & Poor’s, one of the nation’s leading credit-rating agencies, in recognition of the",https://gcaptain.com/port-of-long-beach-receives-credit-ratings-upgrade-amid-downturn/,"December 23, 2022"
Shanghai Port Strives to Keep Global Trade Moving as COVID Wave Sweeps China,"By Bloomberg News (Bloomberg) — Shanghai, the world’s biggest container port, is isolating the shipment of international goods to prevent disruptions",https://gcaptain.com/shanghai-port-strives-to-keep-global-trade-moving-as-covid-wave-sweeps-china/,"December 23, 2022"
"U.S. Imports Decline Accelerates in November, Led By ‘Staggering’ Drop for West Coast Ports -Report",Imports through the top ten container ports in the U.S. marked the largest overall monthly decline since the financial crisis and likely the largest single,https://gcaptain.com/u-s-imports-accelerate-declines-in-november-led-by-staggering-drop-for-west-coast-ports-report/,"December 21, 2022"
Saudi Arabia Invests $2.4 Billion in Key Dubai Ports,By Adveith Nair and Matthew Martin (Bloomberg) — Saudi Arabia is buying stakes in three flagship DP World developments in the United Arab Emirates for,https://gcaptain.com/saudi-arabia-invests-2-4-billion-in-key-dubai-ports/,"December 21, 2022"
Port Houston Posts Another Container Gain in November,"If U.S. imports are slowing, Port Houston has yet to get the memo. The U.S. Gulf Coast’s busiest port reported an 11% jump in container volumes in",https://gcaptain.com/port-houston-posts-another-container-gain-in-november/,"December 19, 2022"
Ports of Los Angeles and Long Beach to End Container Dwell Fee They Never Implemented,"The ports of Los Angeles and Long Beach have announced plans to end the Container Dwell Fee that they never technically implemented, marking the latest sign",https://gcaptain.com/ports-of-los-angeles-and-long-beach-to-end-container-dwell-fee-they-never-implemented/,"December 16, 2022"
Cargo Slowdown Continues at Port of Los Angeles,"Cargo volume remained soft at the Port of Los Angeles in November, with imports falling 24% compared to the same month last year, the port said Wednesday. An",https://gcaptain.com/cargo-slowdown-continues-at-port-of-los-angeles/,"December 15, 2022"
Imports Lull Continues at Port of Long Beach,"Containerized imports through the Port of Long Beach fell by nearly a third in November amid reduced orders from retailers, full warehouses and shifting trade",https://gcaptain.com/imports-lull-continues-at-port-of-long-beach/,"December 14, 2022"
Louisiana Governor Announces $1.8 Billion Port Expansion Project,"Louisiana Governor John Bel Edwards has announced a historic public-private partnership between the state of Louisiana, the Port of New Orleans and two leading",https://gcaptain.com/louisiana-governor-announces-1-8-billion-port-expansion-project/,"December 13, 2022"
Port of Savannah Sees Container Lull in November,The Port of Savannah saw some easing of container demand in November amid inflation and a shift in consumer spending. The Georgia Ports Authority said it moved,https://gcaptain.com/port-of-savannah-sees-container-lull-in-november/,"December 13, 2022"
U.S. Container Imports Near Pre-Pandemic Levels in November,"U.S. container imports fell a whopping 19.4% in November compared to the same month last year as economic turmoil, a reduction in retail transactions, and high",https://gcaptain.com/u-s-container-imports-near-pre-pandemic-levels-in-november/,"December 12, 2022"
Port Houston Sees No Signs of Cargo Slow Down in October,Port Houston is reporting another month of double digit growth in October with no signs of a cargo slow down even as total U.S. inbound volumes continue to,https://gcaptain.com/port-houston-sees-no-signs-of-cargo-slow-down-in-october/,"November 22, 2022"
Abu Dhabi Ports Acquires Spanish Logistics Firm to Further Global Expansion,"By Leen Al-Rashdan (Bloomberg) — Abu Dhabi Ports Group has purchased Spanish logistics firm Noatum for $680 million, its second acquisition this month",https://gcaptain.com/abu-dhabi-ports-acquires-spanish-logistics-firm-to-further-global-expansion/,"November 18, 2022"
October Imports at Port of Los Angeles Plunge to Lowest Level Since 2009,Imports through the Port of Los Angeles crashed by nearly a third in October to the lowest monthly level in more than a decade. Cargo volumes at the Port,https://gcaptain.com/october-imports-at-port-of-los-angeles-plunge-to-lowest-level-since-2009/,"November 17, 2022"
Svitzer Ordered to Scrap Harbor Tug Worker Lockout in Australia,"Australia’s Fair Work Commission has ruled that Svitzer Australia, a subsidiary of Danish shipping giant A.P. Moller-Maersk, must scrap its plans for a",https://gcaptain.com/svitzer-ordered-to-scrap-harbor-tug-worker-lockout-in-australia/,"November 17, 2022"
Svitzer Planning Lockout of Australian Harbor Tug Crews in Dispute with Unions,"Towage operator Svitzer, an A.P. Moller-Maersk subsidiary, has announced an indefinite lockout of Australian harbor tug crews over an industrial labor dispute",https://gcaptain.com/svitzer-planning-lockout-of-australian-harbor-tug-crews-in-dispute-with-unions/,"November 15, 2022"
"As U.S. Container Imports Fall, Port of Savannah Reports Second Busiest Month in October","Bucking the trend of falling inbound containers, the Port of Savannah recorded its second busiest month on record in October as the East Coast port continues",https://gcaptain.com/as-u-s-container-imports-fall-port-of-savannah-reports-second-busiest-month-in-october/,"November 14, 2022"
Singapore Bunker Fuel Sales Hit 52-Week High,"By Jeslyn Lerh (Reuters) Marine fuel sales in Singapore surged to a one-year high in October, latest official data showed on Monday, as more competitive prices",https://gcaptain.com/singapore-bunker-fuel-sales/,"November 14, 2022"
October Imports Tumble at Port of Long Beach,Containerized imports landing at the Port of Long Beach fell by nearly 24% last month amid reduced consumer demand and a shift of imported goods toward the,https://gcaptain.com/october-imports-tumble-at-port-of-long-beach/,"November 11, 2022"
Falling U.S. Container Imports From China Hit West Coast Ports in October -Report,"U.S. container imports tumbled again last month compared to a year ago as a decline in Chinese volumes continued to impact West Coast ports, according to new",https://gcaptain.com/falling-u-s-imports-from-china-hits-west-coast-container-ports-in-october-report/,"November 7, 2022"
Singapore and U.S. West Coast Ports Launching Green Corridor to Help Push Shipping on Emissions,The Port of Singapore is partnering with the Port of Los Angeles and Port of Long Beach to establish a “green corridor” to help tackle carbon,https://gcaptain.com/singapore-and-u-s-west-coast-ports-launching-green-corridor-to-help-push-shipping-on-emissions/,"November 7, 2022"
This Year’s Holiday Spending Likely to Set New Record,The National Retail Federation is forecasting that holiday spending will be healthy this year despite inflationary challenges and consumers shifting back to,https://gcaptain.com/this-years-holiday-spending-likely-to-set-new-record/,"November 4, 2022"
New Container Terminal Would Boost Capacity at Port of Baltimore,"The Port of Baltimore, one of the busiest in the country for roll/on-roll/off cargo, is set for a big boost to its container handling capacity. A new private",https://gcaptain.com/new-container-terminal-would-boost-capacity-at-port-of-baltimore/,"November 4, 2022"
Port Houston to Begin Charging for Long-Dwelling Import Containers,Port Houston has announced plans to start charging cargo owners with a dwell fee for import containers lingering at marine terminals beyond a free period to,https://gcaptain.com/port-houston-to-begin-charging-for-long-dwelling-import-containers/,"November 3, 2022"
Crowley Picked to Develop California Offshore Wind Hub,"Plans are taking shape for a West Coast wind port to serve as California’s first hub for offshore wind energy installations.   Jacksonville,",https://gcaptain.com/crowley-picked-to-develop-california-offshore-wind-hub/,"October 31, 2022"
New York City Receives $5 Million Grant To Improve Water Freight Services And Marine Highways,"NYCEDC, NEW YORK, NY—New York City Economic Development Corporation (NYCEDC) today announced that New York City has been selected for a $5.16 million federal",https://gcaptain.com/usdot-grant-to-improve-new-york-citys-water-freight-services-and-marine-highways/,"October 30, 2022"
Port of Long Beach Receives $30.1 Million To Fund Zero-Emissions Cargo Handling Equipment,The Port of Long Beach announced Friday it will receive a $30.1 million grant from the U.S. Department of Transportation to deploy the nation’s largest fleet,https://gcaptain.com/port-of-long-beach-receives-30-1-million-to-fund-zero-emissions-cargo-handling-equipment/,"October 29, 2022"
Buttigieg Announces $703M For US Port Infrastructure,"by John Konrad (gCaptain) Today, U.S. Department of Transportation secretary Pete Buttigieg announced more than $703 million to fund 41 projects in 23 US",https://gcaptain.com/buttigieg-announces-703m-for-us-port-infrastructure/,"October 28, 2022"
Olaf Scholz Suggests Europe Should ‘Diversify’ By Selling More Ports To China,by Andreas Rinke (Reuters) German Chancellor Olaf Scholz on Thursday stressed the need for Europe to diversify its relations to ensure it is not dependent on,https://gcaptain.com/olaf-scholz-suggests-europe-should-diversify-by-selling-more-ports-to-china/,"October 27, 2022"
Europe LNG Port Congestion May Last Through November,By Belén Carreño (Reuters) – Several ships carrying liquefied natural gas (LNG) anchored off Spain’s Bay of Cadiz are likely to stay there,https://gcaptain.com/europe-lng-port-congestion-continues/,"October 26, 2022"
Hamburg Port Sale To China Unleashes Protest,While NATO and most of the international defense community – including US Secretary of Defense Lloyd Austin and US Transportation Command General Van,https://gcaptain.com/hamburg-port-sale-to-china-unleashes-protest/,"October 26, 2022"
Buttigieg Announces $703M For US Port Infrastructure,"by John Konrad (gCaptain) Today, U.S. Department of Transportation secretary Pete Buttigieg announced more than $703 million to fund 41 projects in 23 US",https://gcaptain.com/buttigieg-announces-703m-for-us-port-infrastructure/,"October 28, 2022"
Olaf Scholz Suggests Europe Should ‘Diversify’ By Selling More Ports To China,by Andreas Rinke (Reuters) German Chancellor Olaf Scholz on Thursday stressed the need for Europe to diversify its relations to ensure it is not dependent on,https://gcaptain.com/olaf-scholz-suggests-europe-should-diversify-by-selling-more-ports-to-china/,"October 27, 2022"
Europe LNG Port Congestion May Last Through November,By Belén Carreño (Reuters) – Several ships carrying liquefied natural gas (LNG) anchored off Spain’s Bay of Cadiz are likely to stay there,https://gcaptain.com/europe-lng-port-congestion-continues/,"October 26, 2022"
Hamburg Port Sale To China Unleashes Protest,While NATO and most of the international defense community – including US Secretary of Defense Lloyd Austin and US Transportation Command General Van,https://gcaptain.com/hamburg-port-sale-to-china-unleashes-protest/,"October 26, 2022"
South Africa Welcomes Sanctioned Russian Yacht,By Paul Burkhardt (Bloomberg) South Africa’s government said it has “no reason” to apply sanctions brought against Russian tycoon Alexey Mordashov and,https://gcaptain.com/south-africa-welcomes-russian-superyacht/,"October 26, 2022"
US Dockworker Union Deal Will Take Months Says Seroka,"By Ana Monteiro (Bloomberg) A labor deal between 22,000 dockworkers at US West Coast ports and their employers may take several months to reach, but service",https://gcaptain.com/us-dockworker-union-deal-will-take-months-says-seroka/,"October 25, 2022"
Germany Unlikely To Block China Port Buy,"By Christian Kraemer (Reuters) – Germany may allow China’s Cosco to take a smaller stake than originally planned in a Hamburg port terminal, in",https://gcaptain.com/germany-unlikely-to-block-china-port-buy/,"October 25, 2022"
EU Warned Germany Against China Port Buy,by Markus Wacket (Reuters) The European Commission warned the German government last spring not to approve an investment by China’s Cosco into,https://gcaptain.com/eu-warns-germany-against-china-port-buy/,"October 23, 2022"
How Water Has Been Weaponised In Ukraine,"By Jonathan Landay MYKOLAIV, Ukraine, Oct 22 (Reuters) – Sveta has no doubt about why the Ukrainian-held southern city of Mykolaiv, a",https://gcaptain.com/how-water-has-been-weaponised-in-ukraine/,"October 22, 2022"
German Chancellor Tries to Quell Dispute Over Port Deal with China’s COSCO,By Arne Delfs and Birgit Jennen (Bloomberg) — German Chancellor Olaf Scholz denied reports that he has already reached a decision over the disputed sale,https://gcaptain.com/german-chancellor-tries-to-quell-dispute-over-port-deal-with-chinas-cosco/,"October 21, 2022"
Port of Rotterdam Throughput Flat This Year as Coal and LNG Offset Container Drop,"AMSTERDAM, Oct 21 (Reuters) – Throughput volumes for Europe’s largest port of Rotterdam have risen 0.3% to 351 million tonnes in the",https://gcaptain.com/port-of-rotterdam-throughput-flat-this-year-as-coal-and-lng-offset-container-drop/,"October 21, 2022"
Port of Los Angeles Took a Beating in September,"Imports at the Port of Los Angeles fell by a dramatic 27% in September as retailers sit on high levels inventory on shelves and in warehouses, the",https://gcaptain.com/port-of-los-angeles-took-a-beating-in-september/,"October 19, 2022"
Port of Long Beach Imports Fall in September,"Imports at the Port of Long Beach fell for a third consecutive month in September as diminishing consumer demand, full warehouses and inflation concerns led to",https://gcaptain.com/port-of-long-beach-imports-fall-in-september/,"October 18, 2022"
Port Houston Container Volumes Stay Strong in September,Port Houston on the U.S. Gulf Coast has reported another very strong month in September as it continued to benefit from shifted inbound trade flows in the,https://gcaptain.com/port-houston-container-volumes-stay-strong-in-september/,"October 17, 2022"
California Calls for Projects for $1.2 Billion in Port and Freight Infrastructure Funding,The state of California has issued a call for projects for the $1.2 billion in one-time state funding for port and freight infrastructure projects. Finalized,https://gcaptain.com/california-calls-for-projects-for-1-2-billion-in-port-and-freight-funding/,"October 17, 2022"
Liverpool Dockworkers Plan Two More Weeks of Strikes,By Eamon Akil Farhat (Bloomberg) — Dock workers at the Port of Liverpool are planning two more weeks of strikes after a pay dispute escalated into a,https://gcaptain.com/liverpool-dockworkers-plan-two-more-weeks-of-strikes/,"October 14, 2022"
Hapag-Lloyd Among Shortlisted Bidders for GCT Terminals in New York and New Jersey,"By Gillian Tan, Kiel Porter and Kamaron Leach (Bloomberg) — Ports America, Terminal Investment Ltd., Carrix and Hapag-Lloyd AG are among shortlisted",https://gcaptain.com/hapag-lloyd-among-shortlisted-bidders-for-gct-terminals-in-new-york-and-new-jersey/,"October 14, 2022"
Port of Savannah Sees Signs of Market Correction,"Cargo volumes through the Port of Savannah tumbled more than 7 percent in September in part due to impacts related to Hurricane Ian. Even so, the port closed",https://gcaptain.com/port-of-savannah-sees-signs-of-market-correction/,"October 13, 2022"
Liverpool Dockers Strike as Peel Ports Issues Redundancies,By Eamon Akil Farhat (Bloomberg) — Dock workers in the Port of Liverpool resumed a strike over pay Tuesday as their employer Peel Ports Ltd. issued,https://gcaptain.com/liverpool-dockers-strike-as-peel-ports-issues-redundancies/,"October 12, 2022"
Labor Strike Hobbles South Africa’s Busiest Port,(Reuters) – Staff shortages caused by an ongoing strike over wages are impacting container and car terminals at South Africa’s Durban,https://gcaptain.com/labor-strike-hobbles-south-africas-busiest-port/,"October 12, 2022"
How Water Has Been Weaponised In Ukraine,"By Jonathan Landay MYKOLAIV, Ukraine, Oct 22 (Reuters) – Sveta has no doubt about why the Ukrainian-held southern city of Mykolaiv, a",https://gcaptain.com/how-water-has-been-weaponised-in-ukraine/,"October 22, 2022"
German Chancellor Tries to Quell Dispute Over Port Deal with China’s COSCO,By Arne Delfs and Birgit Jennen (Bloomberg) — German Chancellor Olaf Scholz denied reports that he has already reached a decision over the disputed sale,https://gcaptain.com/german-chancellor-tries-to-quell-dispute-over-port-deal-with-chinas-cosco/,"October 21, 2022"
Port of Rotterdam Throughput Flat This Year as Coal and LNG Offset Container Drop,"AMSTERDAM, Oct 21 (Reuters) – Throughput volumes for Europe’s largest port of Rotterdam have risen 0.3% to 351 million tonnes in the",https://gcaptain.com/port-of-rotterdam-throughput-flat-this-year-as-coal-and-lng-offset-container-drop/,"October 21, 2022"
Port of Los Angeles Took a Beating in September,"Imports at the Port of Los Angeles fell by a dramatic 27% in September as retailers sit on high levels inventory on shelves and in warehouses, the",https://gcaptain.com/port-of-los-angeles-took-a-beating-in-september/,"October 19, 2022"
Port of Long Beach Imports Fall in September,"Imports at the Port of Long Beach fell for a third consecutive month in September as diminishing consumer demand, full warehouses and inflation concerns led to",https://gcaptain.com/port-of-long-beach-imports-fall-in-september/,"October 18, 2022"
Port Houston Container Volumes Stay Strong in September,Port Houston on the U.S. Gulf Coast has reported another very strong month in September as it continued to benefit from shifted inbound trade flows in the,https://gcaptain.com/port-houston-container-volumes-stay-strong-in-september/,"October 17, 2022"
