headline,description,link,date
EPA finalizes VIDA incidental discharge standards,"In a regulatory action that has been long in the works, the U.S. Envionmental Protection Administration has released the pre-publication version of its final rule to establish Vessel Incidental Discharge National Standards",https://www.marinelog.com/inland-coastal/epa-finalizes-vida-incidental-discharge-standards/,"September 25, 2024"
Podcast: Jennifer Carpenter helps lead maritime to success,"In this episode of Marine Log’s Listen Up! Podcast, we once again talk to Jennifer Carpenter, president of American Maritime Partnership (AMP). When we last talked to Jennifer, it was under her",https://www.marinelog.com/podcasts-1/podcast-jennifer-carpenter-helps-lead-maritime-to-success/,"July 31, 2024"
Maersk Line Limited reaches settlement in whistleblower case,"As part of a settlement with the U.S. Department of Labor in a whistleblower case, Maersk’s U.S.-flag subsidiary, Maersk Line Limited is to change its safety reporting policies and compensate a seaman",https://www.marinelog.com/legal/maersk-line-limited-reaches-settlement-in-whistleblower-case/,"July 26, 2024"
Liberian Registry hires Giorgio De Sciora for key role,"The Liberian Registry has named Captain Giorgio De Sciora its new vice president of regulations and standards, maritime operations. In this position, De Sciora will direct and oversee the application of new",https://www.marinelog.com/passenger/cruiseships/liberian-registry-hires-giorgio-de-sciora-for-key-role/,"July 19, 2024"
"Ship owners face hefty emission bills under EU-ETS, warns Oceanly","The integration of the shipping sector into the European Union Emissions Trading System (EU-ETS) brings substantial costs and compliance challenges for ship owners and Rapallo, Italy, headquartered fleet performance solutions specialist Oceanly",https://www.marinelog.com/legal/compliance/ship-owners-face-hefty-emission-bills-under-eu-ets-warns-oceanly/,"June 26, 2024"
Industry makes progress in fight against dangerous CARB DPF requirement,"In a major milestone for mariner safety in California, the California Senate Transportation Committee has voted 14-0 in favor of a measure that would prevent the California Air Resources Board (CARB) from",https://www.marinelog.com/inland-coastal/industry-makes-progress-in-fight-against-dangerous-carb-dpf-requirement/,"June 13, 2024"
FMC launches probe of Canadian ballast water regs,"Pending Canadian ballast water management regulations have been slammed as “the epitome of an unfair business practice,” by the U.S. based Lake Carriers Association (LCA), which filed a petition asking the Federal",https://www.marinelog.com/legal/regulations/fmc-launches-probe-of-canadian-ballast-water-regs/,"May 21, 2024"
EC’s Union Database plan could limit biofuel availability to ships,"Here’s a development that operators with vessels trading to Europe need to pay attention to, particularly if they have hopes of getting European ETS and FuelEU credits by using green methanol or",https://www.marinelog.com/legal/environment/ecs-union-database-plan-could-limit-biofuel-availability-to-ships/,"April 18, 2024"
Denmark will ban scrubber water discharges,"The Danish Ministry of the Environment said today that, from July 1, 2025, the discharge of exhaust gas scrubber water from ships will be prohibited in waters up to 22 kilometers (about",https://www.marinelog.com/legal/environment/denmark-will-ban-scrubber-water-discharges/,"April 11, 2024"
Support grows for USTR to slap U.S. port fees on Chinese-built ships,U.S. Senators Tammy Baldwin (D-Wis.) and Bob Casey (D-Pa.) are seeing growing support for their push for the Biden Administration to initiate an investigation into the People’s Republic of China’s (PRC) unfair,https://www.marinelog.com/legal/legislation/support-grows-for-ustr-to-slap-u-s-port-fees-on-chinese-built-ships/,"April 10, 2024"
USMX seeks NLRB intervention as port strike looms,"With a threatened Maine to Texas port strike on October 1 getting ever nearer, the employers organization, the United States Marine Alliance (USMX), today filed with the National Labor Relations Board (NLRB)",https://www.marinelog.com/inland-coastal/ports-terminals/usmx-seeks-nlrb-intervention-as-port-strike-looms/,"September 26, 2024"
AAPA reconstitutes Latin American presence with AAPA Latin America,The American Association of Port Authorities (AAPA) recently announced the reconstitution of its presence in Latin America with the launch of AAPA Latin America. AAPA says this initiative reflects a strategic decision,https://www.marinelog.com/inland-coastal/ports-terminals/aapa-reconstitutes-latin-american-presence-with-aapa-latin-america/,"September 20, 2024"
Jefferson County Port Authority purchases 18 acre riverside site,"The Jefferson County, Missouri, Port Authority (JCPA) has closed on the $20 million purchase of approximately 18 acres along the Mississippi River at 600 Riverport Way in Herculaneum, Mo. The acreagewas sold",https://www.marinelog.com/inland-coastal/inland/jefferson-county-port-authority-purchases-18-acre-riverside-site/,"September 13, 2024"
Ports of Indiana celebrates opening of its first new dock in 20 years,Local officials and port workers celebrated the opening today of a new $6 million dock that will serve ocean vessels at Ports of Indiana-Burns Harbor. Partially funded by a U.S. Maritime Administration,https://www.marinelog.com/inland-coastal/ports-of-indiana-celebrates-opening-of-its-first-new-dock-in-20-years/,"September 06, 2024"
AWO urges speedy signature of California AB 1122  to protect mariner safety,The California legislature has now passed Assemblymember Dr. Jasmeet Bains’ measure (AB 1122) that would prevent the California Air Resources Board (CARB) from enforcing a potentially deadly requirement in its harbor craft,https://www.marinelog.com/legal/legislation/awo-urges-speedy-signature-of-california-ab-1122-to-protect-mariner-safety/,"September 06, 2024"
MV Canopée: Wind-assisted RO/RO rocket ship makes first U.S. port visit,"The MV Canopée, the world’s first new generation wind-assisted hybrid propulsion commercial RO/RO vessel, arrived in Port Canaveral, Fla., yesterday, marking its inaugural U.S. visit. Launched in 2022, the MV Canopée is",https://www.marinelog.com/news/mv-canopee-wind-assisted-ro-ro-rocket-ship-makes-first-u-s-port-visit/,"September 05, 2024"
VIDEO: ILA ramps up port strike rhetoric,"Fears that a Maine to Texas port strike by the International Longshoremens Association (ILA) could become a reality on October 1 are growing, with Torsten Hartmann, senior director trade management transpacific at",https://www.marinelog.com/inland-coastal/ports-terminals/video-ila-ramps-up-port-strike-rhetoric/,"September 05, 2024"
Port of Bellingham gets $17.9M grant to reconnect the shipping terminal to rail,"The Port of Bellingham, Wash., recently announced that it has secured a $17.9 million federal grant from the U.S. Department of Transportation (DOT). The grant will be used to reconnect the Bellingham",https://www.marinelog.com/inland-coastal/ports-terminals/port-of-bellingham-gets-17-9m-grant-to-reconnect-the-shipping-terminal-to-rail/,"August 28, 2024"
Port of Los Angeles names Calhoun as deputy executive director of harbor administration,"The Port of Los Angeles has appointed Erica Calhoun as its deputy executive director, overseeing the City of Los Angeles Harbor Department’s Administrative Bureau. In this new position, Calhoun will be responsible",https://www.marinelog.com/inland-coastal/ports-terminals/port-of-los-angeles-names-calhoun-as-deputy-executive-director-of-harbor-administration/,"August 23, 2024"
Construction underway for future home of MSC Seascape cruise ship,"Construction is underway at the Port of Galveston to convert an existing cargo warehouse into the port’s fourth cruise terminal. The $151 million cruise complex at Pier 16 will include a 165,000-square-foot",https://www.marinelog.com/passenger/cruiseships/construction-underway-for-future-home-of-msc-seascape-cruise-ship/,"August 21, 2024"
MEPC 81: A global carbon tax on shipping is getting closer,"As IMO’s MEPC 81 was going on in London last week, ABS Chairman and CEO Christopher J. Wiernicki was telling a session of the CERAWeek energy conference in Houston that a universal,",https://www.marinelog.com/legal/environment/mepc-81-a-global-carbon-tax-on-shipping-is-getting-closer/,"March 25, 2024"
Bearing brings maritime AI to bear on EU ETS compliance,"Palo Alto, Calif., headquartered maritime AI (artificial intelligence) solutions provider Bearing AI has launched an update to its Fleet Deployment Optimizer (FDO) solution that is designed to help shipping companies manage their",https://www.marinelog.com/legal/regulations/bearing-brings-maritime-ai-to-bear-on-eu-ets-compliance/,"March 06, 2024"
Coast Guard launches new format merchant mariner credential,"The U.S. Coast Guard will launch a new merchant mariner credential (MMC) on March 1, 2024. The agency is replacing the MMC passport-style booklet (“Red Book”) with a new, certificate size, one",https://www.marinelog.com/legal/safety-and-security/coast-guard-launches-new-format-merchant-mariner-credential/,"February 27, 2024"
Biden administration pauses new LNG export project permitting,"Citing climate crisis concerns, the Biden Administration today announced a temporary pause on pending approvals of liquefied natural gas (LNG) export projects. The U.S. Department of Energy (DOE) says that it will",https://www.marinelog.com/news/biden-administration-pauses-new-lng-export-project-permitting/,"January 26, 2024"
USCG moves ahead on plans for Atlantic Coast shipping fairways,The U.S. Coast Guard has released a Notice of Proposed Rulemaking (NPRM) proposing a system of shipping safety fairways along the U.S. Atlantic Coast. The NPRM comes as plans for Atlantic Coast,https://www.marinelog.com/legal/regulations/uscg-moves-ahead-on-plans-for-atlantic-coast-shipping-fairways/,"January 19, 2024"
Stinne Taiger Ivø named BIMCO deputy secretary general,"The world’s largest shipping association, Copenhagen-headquartered BIMCO, has appointed its director of contracts & support, Stinne Taiger Ivø, as deputy secretary general, effective January 1, 2024. She succeeds Søren Larsen, who will",https://www.marinelog.com/legal/shipping/stinne-taiger-ivo-named-bimco-deputy-secretary-general/,"January 03, 2024"
MARAD updates Title XI regulations,"By providing long-term debt repayment guarantees, the U.S. Maritime Administration’s Title XI Federal Ship Financing Program is intended to encourage U.S. shipowners to obtain new vessels from U. S. shipyards cost effectively",https://www.marinelog.com/legal/regulations/marad-updates-title-xi-regulations/,"December 18, 2023"
Senator says Buy American waiver should not apply to Small Shipyard grants,U.S. Senator Tammy Baldwin (D-Wis.) is calling on the Biden Administration to commit to never applying a recently finalized Buy American waiver to shipyard grants and to help ensure American companies and,https://www.marinelog.com/legal/regulations/senator-says-buy-american-waiver-should-not-apply-to-small-shipyard-grants/,"September 13, 2023"
CMA CGM reaches settlements with EPA on VGP violation claims,The U.S. Environmental Protection Agency (EPA) has reached a settlement with container shipping giant CMA CGM over two claims of violations of EPA’s Vessel General Permit (VGP) issued under the Clean Water,https://www.marinelog.com/legal/compliance/cma-cgm-reaches-settlements-with-epa-on-vgp-violation-claims/,"August 03, 2023"
Europe’s FuelEU aims to kick start shift to greener fuels,"Europe’s FuelEU legislation has now been adopted by the European Council and will come fully into effect from January 2025, though some requirements will come into effect from August 31, 2024. The",https://www.marinelog.com/legal/environment/europes-fueleu-aims-to-kick-start-shift-to-greener-fuels/,"July 25, 2023"
Op-Ed: Maritime industry’s role in Florida’s energy and hurricane resilience,"By David Wood, President of Florida Maritime Partnership With 22 million residents, 140 million visitors a year, and two of the top 10 busiest airports in the nation, Florida’s demand for gasoline",https://www.marinelog.com/views/op-eds/op-ed-maritime-industrys-role-in-floridas-energy-and-hurricane-resilience/,"August 19, 2024"
U.S. port strike fears stoked as ILWU pledges solidarity with ILA,"Raising the specter that a threatened Maine to Texas U.S. port strike could ratchet into something even further reaching, Willie Adams, U.S. West Coast dockworkers’ union president on Friday wrote International Longshoremen’s",https://www.marinelog.com/inland-coastal/ports-terminals/u-s-port-strike-fears-stoked-as-ilwu-pledges-solidarity-with-ila/,"August 19, 2024"
STAX Engineering wins five-year tanker emissions capture contract,"From January 2025, California Air Resources Board (CARB) at-berth emissions regulations will apply to tankers calling at the Port of Los Angeles and the Port of Long Beach. That has brought Long",https://www.marinelog.com/legal/environment/stax-engineering-wins-five-year-tanker-emissions-capture-contract/,"August 15, 2024"
Fears of Maine to Texas port strike grow,Inbound cargo volume at America’s major container ports could see a near-record surge this month as retailers bring in merchandise ahead of a potential port strike at East Coast and Gulf Coast,https://www.marinelog.com/inland-coastal/ports-terminals/fears-of-maine-to-texas-port-strike-grow/,"August 15, 2024"
Three more West Coast ports join DOT’s FLOW initiative,"The U.S. Department of Transportation (DOT) reports that the Port of Oakland and the Northwest Seaport Alliance, which includes the Port of Seattle and Port of Tacoma, are now members of the",https://www.marinelog.com/news/three-more-west-coast-ports-join-dots-flow-initiative/,"August 14, 2024"
VIDEO: Box ship explosion rocks Port of Ningbo,"One of the world’s busiest ports, China’s Port of Ningbo was has been rocked by a massive explosion that sent a huge fire ball into the air. The Chinese Government run Global",https://www.marinelog.com/inland-coastal/ports-terminals/video-box-ship-explosion-rocks-port-of-ningbo/,"August 09, 2024"
Seatrium AmFELS retires dry dock after 28 years of service at Port of Brownsville,"After nearly 30 years of service at Seatrium AmFEL’s shipyard in Brownsville, Texas, the Solomon P. Ortiz floating dry dock was retired in May and the contract for its dismantling and recycling",https://www.marinelog.com/shipbuilding/shipyards/shipyard-news/dry-dock-retires-after-28-years-of-service-at-port-of-brownsville/,"August 07, 2024"
Op-Ed: Port operators are fighting a new tidal wave of crime,"Ports must counter soaring levels of cargo theft with more robust insurance and security measures, warns Ed McNamara CEO of global port insurer Armada Risk Partners. In the U.S. cargo thefts are",https://www.marinelog.com/views/op-eds/op-ed-port-operators-are-fighting-a-new-tidal-wave-of-crime/,"August 07, 2024"
NOAA breaks ground on research ship pier renovations,"NOAA officials and regional partners have broken ground on renovations to its North Charleston, S.C., pier. The pier renovations will include demolishing and building a new pier that includes shoreside power for",https://www.marinelog.com/news/noaa-breaks-ground-on-research-ship-pier-renovations/,"July 30, 2024"
California’s Port San Luis eyes its offshore wind options,The Port San Luis Harbor District has entering into a project evaluation agreement with offshore wind port developer Clean Energy Terminals (CET) to explore the feasibility of an offshore wind operations and,https://www.marinelog.com/offshore/offshore-wind/californias-port-san-luis-eyes-its-offshore-wind-options/,"July 24, 2024"
VIDEO: UN Sec Gen to IMO: Do your job,"As the International Maritime Organization’s Marine Environmental Protection Committee started a crucial session on GHG reduction targets (MEPC 80), United Nations Secretary Secretary-General António Guterres called for meaningful action and said measures",https://www.marinelog.com/news/video-un-sec-gen-to-imo-do-your-job/,"July 03, 2023"
IP Code adoption sets new standard for industrial personnel carriage ,"Amendments to the SOLAS Convention will mandate application of the International Code of Safety for Ships Carrying Industrial Personnel from July 1, 2024, writes Joseph Gardemal, ABS Manager, Regulatory Affairs  Expansion of",https://www.marinelog.com/legal/regulations/ip-code-adoption-sets-new-standard-for-industrial-personnel-carriage/,"April 28, 2023"
EU ETS revision sends IMO a message on maritime decarbonization,"While the UN’s International Maritime Organization continues to dither on shipping’s proposals to fund maritime decarbonization using some sort of levy on carbon, the European Union is taking a very different approach",https://www.marinelog.com/legal/shipping/eu-ets-revision-sends-imo-a-message-on-decarbonization/,"April 19, 2023"
IMO MEPC 79: further progress on protecting the marine environment,"By Joseph Gardemal, ABS Manager, Regulatory Affairs The IMO Marine Environment Protection Committee (MEPC) held its 79th session from December 12-16, 2022, with a full agenda reflecting numerous issues of importance to",https://www.marinelog.com/legal/regulations/imo-mepc-79-further-progress-on-protecting-the-marine-environment/,"March 31, 2023"
Cybutryne ban in hull coatings comes into force,"By Muammer Akturk, ABS Senior Surveyor  Amendments to the International Convention on the Control of Harmful Antifouling Systems on Ships (AFS Convention) adopted by the IMO ban the presence of cybutryne in",https://www.marinelog.com/legal/regulations/cybutryne-ban-in-hull-coatings-comes-into-force/,"February 14, 2023"
ABS to support CARB on implementation of new harbor craft emissions reg,"ABS is to support the California Air Resources Board (CARB) on implementation of California’s new requirements to reduce harbor craft emissions, seen by many in industry as being particularly tough. The newly",https://www.marinelog.com/inland-coastal/coastal/abs-to-support-carb-on-implementation-of-new-harbor-craft-emissions-reg/,"February 09, 2023"
Crowley names new VP of global government relations,Crowley has appointed Clay Heil as vice president of global government relations. In that role he will lead the company’s full spectrum of government advocacy for all of its company’s business interests,https://www.marinelog.com/legal/legislation/crowley-names-new-vp-of-global-government-relations/,"February 08, 2023"
FMC will seek additional comments on “Unreasonable Refusal to Deal” rulemaking,"In a briefing this week, the Federal Maritime Commission (FMC) noted that since the signing into law of the Ocean Shipping Reform Act (OSRA), the public is continuing to take advantage of",https://www.marinelog.com/legal/legislation/fmc-will-seek-additional-comments-on-unreasonable-refusal-to-deal-rulemaking/,"January 27, 2023"
BOEM moves to update offshore wind development regs,The Department of the Interior today announced that the Bureau of Ocean Energy Management (BOEM) will publish a proposed rule to update regulations for offshore wind development on the U.S. Outer Continental,https://www.marinelog.com/offshore/offshore-wind/boem-moves-to-update-offshore-wind-development-regs/,"January 13, 2023"
Shipping interests and FMC in ding dong over proposed rulemaking,"On October 14, 2022, the Federal Maritime Commission (FMC) issued a notice of proposed rulemaking (NPR) on detention and demurrage billing requirements. Industry interests didn’t like it, saying that it had aspects",https://www.marinelog.com/legal/shipping/shipping-interests-and-fmc-in-ding-dong-over-proposed-rulemaking/,"January 08, 2023"
Bridge strike scare box ship MSC Michigan VII free to leave  Charleston,The U.S. Coast Guard has lifted the detention order imposed on the containership MSC Michigan VII following the June 6 incident in which a power surge caused it to surge forwards as,https://www.marinelog.com/legal/safety-and-security/bridge-strike-scare-box-ship-msc-michigan-vii-free-to-leave-charleston/,"July 23, 2024"
Sparrows Point Container Terminal aims to be third largest on U.S. East Coast,"Maryland’s Tradepoint Atlantic in Sparrows Point, Md., was much in the news lately as the only the only portion of the Port of Baltimore that remained accessible and operational following the collapse",https://www.marinelog.com/inland-coastal/ports-terminals/sparrows-point-container-terminal-aims-to-be-third-largest-on-u-s-east-coast/,"July 18, 2024"
"Ports of Indiana, Port of Antwerp-Bruges partner to pursue container trade and more",Representatives from Ports of Indiana and Port of Antwerp-Bruges met in Antwerp July 17 to sign a Memorandum of Understanding (MoU) to advance key economic and environmental port initiatives. The landmark agreement,https://www.marinelog.com/inland-coastal/inland/ports-of-indiana-port-of-antwerp-bruges-partner-to-pursue-container-trade-and-more/,"July 17, 2024"
Damen to deliver four vessels for Angola’s Port Namibe project,Japanese trading house Toyota Tusho has awarded Damen Shipyards Group a contract to build four vessels that will be delivered the Ministry of Transport of Angola as part of a Japanese Government,https://www.marinelog.com/inland-coastal/ports-terminals/damen-to-deliver-four-vessels-for-angolas-port-namibe-project/,"July 16, 2024"
Ports get $48.4 million piece of $1.8 billion RAISE grants pie,Port projects are to receive $48.4 million of $1.8 billion of grants awarded June 28 under the U.S. Department of Transportation’s Rebuilding American Infrastructure with Sustainability and Equity (RAISE) program. As in,https://www.marinelog.com/inland-coastal/ports-get-48-4-million-piece-of-1-8-billion-raise-grants-pie/,"July 03, 2024"
Lake Michigan sea cargo terminal plan wins a key CBP approval,U.S. Customs and Border Protection (CBP) has approved a proposal from Ports of Indiana-Burns Harbor to establish the first international sea cargo container terminal on Lake Michigan. This would create the only,https://www.marinelog.com/inland-coastal/ports-terminals/lake-michigan-sea-cargo-terminal-plan-wins-a-key-cbp-approval/,"July 02, 2024"
RFP out for new Port of LA cruise center,"Following up on the draft RFP that it issued back in January 2023, the Port of Los Angeles has issued a request for proposals (RFP) for the construction and operation of a",https://www.marinelog.com/passenger/cruiseships/rfp-out-for-new-port-of-la-cruise-center/,"July 01, 2024"
LA Port Police orders new next-gen patrol vessel,"All American Marine (AAM) reports that it has won a contract to construct a state-of-the-art 65-foot catamaran for the Los Angeles Port Police. Designed by Teknicraft Design in Auckland, New Zealand, the",https://www.marinelog.com/inland-coastal/ports-terminals/la-port-police-orders-new-next-gen-patrol-vessel/,"June 27, 2024"
Joseph Morris named new Port Everglades port director,"The Broward County Commission has confirmed the appointment of Joseph Morris as port director at Port Everglades, Fla. He is currently the port director at Massport (the Massachusetts Port Authority) where he",https://www.marinelog.com/inland-coastal/ports-terminals/joseph-morris-named-new-port-everglades-port-director/,"June 21, 2024"
Carnival Conquest will be first ship to plug in to shore power at Port Miami,"Shore power is arriving for ships docked at PortMiami, and yesterday Carnival Corporation announced that Carnival Conquest would be the first cruise ship to plug into landside electrical power at the cruise",https://www.marinelog.com/passenger/cruiseships/carnival-conquest-will-be-first-ship-to-plug-in-to-shore-power-at-port-miami/,"June 18, 2024"
Two Commissioners seek greater FMC powers on carrier and terminal agreements,Federal Maritime Commissioners Carl W. Bentzel and Max M. Vekich have written key Members of Congress to urge changing the law in a way that would allow the FMC to prohibit agreements,https://www.marinelog.com/legal/shipping/two-commissioners-seek-greater-fmc-powers-on-carrier-and-terminal-agreements/,"December 08, 2022"
FMC unveils interim process for handling shipper complaints,"The Federal Maritime Commission (FMC) has introduced interim procedures to review, investigate, and adjudicate charge complaints filed by shippers to challenge carrier charges. It notes that since the enactment of the Ocean",https://www.marinelog.com/legal/fmc-unveils-interim-process-for-handling-shipper-complaints/,"December 02, 2022"
Liberia streamlines ship mortgage procedures,"The Liberian Registry, the world’s second largest ship registry, in response to the needs of shipowners and the ship finance and legal community, has announced a series of amendments to the Liberian",https://www.marinelog.com/legal/shipping/liberia-streamlines-ship-mortgage-procedures/,"November 08, 2022"
Liner operators ask EU to extend vessel sharing exemption,"The World Shipping Council (WSC), the International Chamber of Shipping (ICS), and the Asian Shipowners’ Association (ASA) have made a submission to the European Commission seeking an extension of the Consortia Block",https://www.marinelog.com/legal/shipping/liner-operators-ask-eu-to-extend-vessel-sharing-exemption/,"October 04, 2022"
AMP sets record straight on need for Puerto Rico Jones Act waiver,Here we go again. Detractors of the Jones Act are having a field day as the media puts out stories about Puerto Rico running short of diesel. Here’s an example from Bloomberg:,https://www.marinelog.com/legal/shipping/amp-sets-record-straight-on-need-for-puerto-rico-jones-act-waiver/,"September 28, 2022"
