headline,description,link,date
Hong Kong Ends Crew Quarantine Curbs For Bunker And Supply Vessels,By Roslan Khasawneh (Reuters) – Hong Kong providers of shipping services are breathing a sigh of relief after authorities announced they would ease,https://gcaptain.com/hong-kong-ends-crew-quarantine-curbs-for-bunker-and-supply-vessels/,"June 15, 2021"
Yantian Port Problems Creating ‘Unprecedented’ Supply Chain Disruption,"By Mike Wackett (The Loadstar) – Shippers are facing a perfect storm as the logistics industry has entered an “an era of unprecedented disruption”,",https://gcaptain.com/yantian-port-problems-creating-unprecedented-supply-chain-disruption/,"June 14, 2021"
Congestion at South China Ports Worsens on Anti-COVID-19 Measures,"By Muyu Xu and Gabriel Crossley BEIJING, June 11 (Reuters) – Congestion at container shipping ports in southern China is worsening as",https://gcaptain.com/congestion-at-south-china-ports-worsens-on-anti-covid-19-measures/,"June 11, 2021"
China’s Buying So Much Corn Its Ports Are Clogging,By Bloomberg News (Bloomberg) — China’s embarked on a record corn-buying spree this year and some vessels have been delayed for as long as a month,https://gcaptain.com/chinas-buying-so-much-corn-its-ports-are-clogging/,"June 11, 2021"
Ships Skip Singapore as China Congestion Snarls Supply Chain,By Ann Koh (Bloomberg) — Delays from congestion at southern Chinese ports triggered by fresh Covid-19 outbreaks are rippling through global supply,https://gcaptain.com/ships-skip-singapore-as-china-congestion-snarls-supply-chain/,"June 11, 2021"
Port of Los Angeles Processes Record 10 Million TEUs for New Western Hemisphere Record,The Port of Los Angeles has become the first port in the Western Hemisphere to handle 10 million twenty-foot equivalent containers (TUE) over a 12-month,https://gcaptain.com/port-of-los-angeles-processes-record-10-million-teus-for-new-western-hemisphere-record/,"June 10, 2021"
Port of Long Beach Reports Best Month on Record in May,"Container volumes at Port of Long Beach broke 900,000 TEU for the first time ever in May as consumer demand continues to show no signs of letting up.",https://gcaptain.com/port-of-long-beach-reports-best-month-on-record-in-may/,"June 9, 2021"
U.S. Retail Ports Continue Record Setting Run as Supply Chains Struggle to Keep Up,The United States’ top ports for retail imports are expected to report another blockbuster month in May as consumers turn to normal shopping patterns as,https://gcaptain.com/u-s-retail-ports-continue-record-setting-run-as-supply-chains-struggle-to-keep-up/,"June 9, 2021"
South China Ports in Crisis as Congestion Spreads,By Sam Whelan (The Loadstar) – South China’s port congestion has gone from bad to worse – delays at Yantian are spilling over to nearby Shekou and,https://gcaptain.com/south-china-ports-in-crisis-as-congestion-spreads/,"June 8, 2021"
U.S. Maritime Regulator Sees Shipping Snarls Lasting to 2022,By Brendan Murray (Bloomberg) — The top U.S. maritime regulator said stretched global supply chains pushing ocean-freight rates to record highs may stay,https://gcaptain.com/u-s-maritime-regulator-sees-shipping-snarls-lasting-to-2022/,"June 8, 2021"
Port of Oakland Reports Busiest Quarter on Record,The Port of Oakland on the U.S. West Coast says containerized trade volume reached record levels in the first quarter of 2021 as the non-stop trade surge,https://gcaptain.com/port-of-oakland-reports-busiest-quarter-on-record/,"May 6, 2021"
Georgia Ports Authority Details Capacity Expansion Plans for Port of Savannah,"The Georgia Ports Authority has reported record volumes of 3.9 million TEUs in its fiscal year to date numbers covering the period July 2020 to March 2021, for",https://gcaptain.com/georgia-ports-authority-details-capacity-expansion-plans-for-port-of-savannah/,"May 4, 2021"
Crew Change Crisis 2.0 – Singapore Bans South Asian Seafarers,"Seafarers have been the invisible victims of COVID-19. Thanks to local restrictions and logistical challenges, hundreds of thousands have been stranded at sea",https://gcaptain.com/crew-change-crisis-singapore-bans-south-asian-seafarers/,"May 2, 2021"
Canada Forces End To Montreal Port Strike – Union Vows To Fight,"May 1 (Reuters) – Striking dockworkers at Canada’s second-biggest port will gradually return to work on Saturday, the Montreal Port Authority",https://gcaptain.com/canada-ends-montreal-port-strike-union-fight/,"May 1, 2021"
Waterways Are Drying Up Making Navigation Difficult In Key South American Crop-Shipping Ports,"The South American drought that’s helping push Wheat, Corn, and Soybean prices to multiyear highs isn’t just threatening crops, but also the",https://gcaptain.com/south-america-waterways-navigation/,"April 27, 2021"
Trudeau Tries To Force Montreal Dock Workers To End Strike,By Sandrine Rastello (Bloomberg) Canada is planning legislation to end a general strike at the Port of Montreal that’s bound to worsen congestion at other,https://gcaptain.com/trudeau-montreal-dock-strike/,"April 27, 2021"
Bulk Copper Prices Soar During Chile Port Strike,"In Chile, a group of port workers this week began protests against the government’s pandemic relief policies, threatening near-term supplies and contributing",https://gcaptain.com/copper-chile-port-strike/,"April 26, 2021"
ILA Union Lawsuit Claims Breach of Master Contract at New U.S. Terminal,"By Gavin van Marle (The Loadstar) – The US east coast is set for another bruising encounter between a dockworker union, shipping line and",https://gcaptain.com/ila-union-lawsuit-claims-breach-of-master-contract-at-new-terminal-at-port-of-charleston/,"April 26, 2021"
Dockworkers Begin Strike at Port of Montreal,"MONTREAL, April 26 (Reuters) – Dockworkers at Canada’s second-largest port on Monday began their second strike in less than a year, as",https://gcaptain.com/dockworkers-begin-strike-at-port-of-montreal/,"April 26, 2021"
Singapore Launches $90 Million Decarbonization Fund for Shipping,"SINGAPORE, April 21 (Reuters) – The Maritime and Port Authority of Singapore (MPA) announced two initiatives on Wednesday to reduce the",https://gcaptain.com/singapore-launches-launches-90-million-decarbonization-fund-for-shipping/,"April 21, 2021"
West Coast Port Congestion Spreads North to Oakland,"By Brendan Murray (Bloomberg) — Los Angeles port officials see progress in reducing their bottleneck of cargo ships. Sail north to Oakland, though, and",https://gcaptain.com/149341-2/,"April 19, 2021"
Crowley Begins Using Biofuel to Power San Francisco Bay Tug ‘Veteran’,U.S.-based Crowley is expanding its use of low carbon biofuel by using it to power one of its tugboats operating San Francisco Bay. Crowley Shipping and Shell,https://gcaptain.com/crowley-begins-using-biofuel-to-power-san-francisco-bay-tug-veteran/,"April 15, 2021"
‘Madness’ at the Port of Los Angeles as Cargo Surge Breaks March and Year-to-Date Records,"The Port of Los Angeles processed 957,599 Twenty-Foot Equivalent Units (TEUs) last month for a 113% leap compared to March 2020 when global trade slowed to a",https://gcaptain.com/madness-at-the-port-of-los-angeles-as-cargo-surge-breaks-march-and-year-to-date-records/,"April 14, 2021"
Partial Strike at Port of Montreal Sparks Fears of More Congestion,By Marcy Nicholson and Sandrine Rastello (Bloomberg) — A partial strike scheduled to start Wednesday by Port of Montreal dockworkers threatens to,https://gcaptain.com/partial-strike-at-port-of-montreal-sparks-fears-of-more-congestion/,"April 13, 2021"
SoCal Port Backlog Continues as Imports Surge Through March,By Brendan Murray (Bloomberg) — Ship congestion outside the busiest U.S. gateway for trade with Asia persisted over the past week as imports surged,https://gcaptain.com/socal-port-backlog-continues-as-imports-surge-through-march/,"April 12, 2021"
CMA CGM Wants To Rebuild Beirut’s Port,"by Gus Trompiz (Reuters) – French container shipping group CMA CGM is pursuing a plan to rebuild Beirut’s port within three years, despite",https://gcaptain.com/cma-cgm-rebuild-beirut-port/,"April 10, 2021"
South Carolina Opens First New Container Terminal in U.S. Since 2009,South Carolina Ports officially opened the new Hugh K. Leatherman Terminal on Friday by welcoming the Hapag Lloyd’s Yorktown Express as the first ship,https://gcaptain.com/south-carolina-new-leatherman-container-terminal/,"April 9, 2021"
Port of Long Beach Had Busiest Month on Record in March,The Port of Long Beach reported its busiest month ever in March as imports continue to pour into U.S. seaports. The Port of Long Beach says the new record,https://gcaptain.com/port-of-long-beach-had-busiest-month-on-record-in-march/,"April 8, 2021"
Global Supply Lines Struggle to Clear Container Backlog After Suez Chaos,"By Jonathan Saul and Timothy Aeppel LONDON/LOS ANGELES, April 8 (Reuters) – A backlog of container ships carrying consumer goods has grown in some key",https://gcaptain.com/global-supply-lines-struggle-to-clear-container-backlog-after-suez-chaos/,"April 8, 2021"
U.S. Trade Deficit Widened to Record in February,By Olivia Rockeman (Bloomberg) — The U.S. trade deficit widened in February to a record high as solid household and business demand kept imports,https://gcaptain.com/u-s-trade-deficit-widened-to-record-in-february/,"April 7, 2021"
Dockworkers Begin Strike at Port of Montreal,"MONTREAL, April 26 (Reuters) – Dockworkers at Canada’s second-largest port on Monday began their second strike in less than a year, as",https://gcaptain.com/dockworkers-begin-strike-at-port-of-montreal/,"April 26, 2021"
Singapore Launches $90 Million Decarbonization Fund for Shipping,"SINGAPORE, April 21 (Reuters) – The Maritime and Port Authority of Singapore (MPA) announced two initiatives on Wednesday to reduce the",https://gcaptain.com/singapore-launches-launches-90-million-decarbonization-fund-for-shipping/,"April 21, 2021"
West Coast Port Congestion Spreads North to Oakland,"By Brendan Murray (Bloomberg) — Los Angeles port officials see progress in reducing their bottleneck of cargo ships. Sail north to Oakland, though, and",https://gcaptain.com/149341-2/,"April 19, 2021"
Crowley Begins Using Biofuel to Power San Francisco Bay Tug ‘Veteran’,U.S.-based Crowley is expanding its use of low carbon biofuel by using it to power one of its tugboats operating San Francisco Bay. Crowley Shipping and Shell,https://gcaptain.com/crowley-begins-using-biofuel-to-power-san-francisco-bay-tug-veteran/,"April 15, 2021"
‘Madness’ at the Port of Los Angeles as Cargo Surge Breaks March and Year-to-Date Records,"The Port of Los Angeles processed 957,599 Twenty-Foot Equivalent Units (TEUs) last month for a 113% leap compared to March 2020 when global trade slowed to a",https://gcaptain.com/madness-at-the-port-of-los-angeles-as-cargo-surge-breaks-march-and-year-to-date-records/,"April 14, 2021"
Partial Strike at Port of Montreal Sparks Fears of More Congestion,By Marcy Nicholson and Sandrine Rastello (Bloomberg) — A partial strike scheduled to start Wednesday by Port of Montreal dockworkers threatens to,https://gcaptain.com/partial-strike-at-port-of-montreal-sparks-fears-of-more-congestion/,"April 13, 2021"
SoCal Port Backlog Continues as Imports Surge Through March,By Brendan Murray (Bloomberg) — Ship congestion outside the busiest U.S. gateway for trade with Asia persisted over the past week as imports surged,https://gcaptain.com/socal-port-backlog-continues-as-imports-surge-through-march/,"April 12, 2021"
CMA CGM Wants To Rebuild Beirut’s Port,"by Gus Trompiz (Reuters) – French container shipping group CMA CGM is pursuing a plan to rebuild Beirut’s port within three years, despite",https://gcaptain.com/cma-cgm-rebuild-beirut-port/,"April 10, 2021"
South Carolina Opens First New Container Terminal in U.S. Since 2009,South Carolina Ports officially opened the new Hugh K. Leatherman Terminal on Friday by welcoming the Hapag Lloyd’s Yorktown Express as the first ship,https://gcaptain.com/south-carolina-new-leatherman-container-terminal/,"April 9, 2021"
Port of Long Beach Had Busiest Month on Record in March,The Port of Long Beach reported its busiest month ever in March as imports continue to pour into U.S. seaports. The Port of Long Beach says the new record,https://gcaptain.com/port-of-long-beach-had-busiest-month-on-record-in-march/,"April 8, 2021"
Global Supply Lines Struggle to Clear Container Backlog After Suez Chaos,"By Jonathan Saul and Timothy Aeppel LONDON/LOS ANGELES, April 8 (Reuters) – A backlog of container ships carrying consumer goods has grown in some key",https://gcaptain.com/global-supply-lines-struggle-to-clear-container-backlog-after-suez-chaos/,"April 8, 2021"
U.S. Trade Deficit Widened to Record in February,By Olivia Rockeman (Bloomberg) — The U.S. trade deficit widened in February to a record high as solid household and business demand kept imports,https://gcaptain.com/u-s-trade-deficit-widened-to-record-in-february/,"April 7, 2021"
Calm Before the Storm: European Ports Await Influx of Ships Impacted by Suez Blockage,"By Mike Wackett (The Loadstar) – The main container ports in North Europe were eerily quiet at the weekend, due to the almost week-long blockage of the",https://gcaptain.com/calm-before-the-storm-european-ports-await-influx-of-ships-impacted-by-suez-blockage/,"April 6, 2021"
South Carolina Ports Sets All-Time Monthly Cargo Record in March,"South Carolina Ports handled the most cargo in its history in March, with the Port of Charleston handling record volumes as the new Hugh K. Leatherman Terminal",https://gcaptain.com/south-carolina-ports-sets-all-time-monthly-cargo-record-in-march/,"April 6, 2021"
Los Angeles Containership Backlog Nears Six-Month Mark,By Brendan Murray (Bloomberg) – Ship congestion outside the biggest U.S. gateway for Asian imports remained elevated with the wait to offload containers,https://gcaptain.com/los-angeles-containership-backlog/,"April 5, 2021"
Germany to Propose Rebuilding Port of Beirut After Chemical Explosion,"By John Irish, Joseph Nasr and Ellen Francis PARIS/BERLIN/BEIRUT, April 2 (Reuters) – Germany will next week present a multi-billion-dollar proposal to",https://gcaptain.com/germany-to-propose-rebuilding-port-of-beirut-after-chemical-explosion/,"April 2, 2021"
Port of Savannah Infrastructure Projects to Boost TEU Capacity Amid Unprecedented Growth,"The Georgia Ports Authority has approved projects to increase annual capacity at the Port of Savannah beyond 6 million twenty-foot equivalent container units,",https://gcaptain.com/port-of-savannah-infrastructure-projects-to-boost-teu-capacity-amid-unprecedented-growth/,"March 31, 2021"
4 Product Tankers Allowed To Dock At Yemen’s Red Sea Port,"by Aziz El Yaakoubi (Reuters) – The Saudi-led coalition has allowed four tankers to dock at Yemen’s Red Sea port of Hodeidah, two sources familiar",https://gcaptain.com/tankers-yemens-red-sea-port/,"March 24, 2021"
Worker Strike Looms at Port of Montreal,By Marcy Nicholson and Sandrine Rastello (Bloomberg) — The biggest port in Eastern Canada may be seeing disrupted shipments if dockworkers and their,https://gcaptain.com/worker-strike-looms-at-port-of-montreal/,"March 23, 2021"
Congestion Hits Brazil’s Largest Port,"By Ana Mano and Marcelo Teixeira (Reuters) – Soy and sugar traders are fighting for room in Latin America’s largest port, rushing to secure loading",https://gcaptain.com/congestion-hits-brazils-largest-port/,"March 23, 2021"
Port of Los Angeles Sets Latest Monthly Record,The United States’ top port for containerized imports from Asia reported its best February on record as the nation’s economy continues to bounce,https://gcaptain.com/port-of-los-angeles-sets-latest-monthly-record/,"March 17, 2021"
Total Awarded Singapore LNG Bunkering License,The Maritime Port Authority of Singapore has awarded Total with a liquified natural gas bunkering license as the world’s largest bunkering hub seeks to,https://gcaptain.com/total-awarded-singapore-lng-bunkering-license/,"March 15, 2021"
Shipping Congestion at Los Angeles Ports Starts Easing,By Brendan Murray (Bloomberg) –Shipping congestion outside the biggest U.S. gateway for imports from Asia showed signs of easing over the past week as,https://gcaptain.com/march-2021-covid-delays-los-angeles-port/,"March 15, 2021"
Busiest February on Record for Port of Long Beach as Import Boom Continues,The Port of Long Beach has reported its busiest February on record amid an unseasonable surge in imports amid the ongoing pandemic-fueled cargo boom. The port,https://gcaptain.com/busiest-february-on-record-for-port-of-long-beach-as-import-boom-continues/,"March 10, 2021"
"Maersk, Keppel Launch Green Ammonia Ship-to-Ship Bunkering Project in Singapore",A handful of major maritime industry stakeholders including Maersk and Keppel have teamed up to study and possibly develop a green ammonia ship-to-ship,https://gcaptain.com/maersk-keppel-launch-green-ammonia-ship-to-ship-bunkering-project-in-singapore/,"March 10, 2021"
2M Snubs Congested West Coast Ports,"By Mike Wackett (The Loadstar) – To improve schedule reliability, 2M partners Maersk and MSC are to avoid congested US west coast ports with two",https://gcaptain.com/2m-snubs-congested-west-coast-ports/,"March 9, 2021"
World’s Largest Oil Export Port Attacked By Yemen’s Houthi Rebels,"By Anthony Di Paola, Vivian Nereim, Javier Blas and Sylvia Westall (Bloomberg) –Saudi Arabia said some of the world’s most protected oil infrastructure",https://gcaptain.com/worlds-largest-oil-export-attack-houthi/,"March 8, 2021"
Congestion Hits Port of Singapore,"By Sam Whelan (The Loadstar) – Major delays have now hit the port of Singapore, with congestion causing vessel turnaround times to more than",https://gcaptain.com/congestion-hits-port-of-singapore/,"March 5, 2021"
U.S. Trade Gap Widens to Near Record as Imports Surge,By Eric Martin (Bloomberg) — The U.S. trade deficit widened to the third-biggest on record in January as imports surged to the highest since mid-2019.,https://gcaptain.com/u-s-trade-gap-widens-to-near-record-as-imports-surge/,"March 5, 2021"
U.S. West Coast Port Congestion Could Last Until Summer Peak Season,"By Mike Wackett (The Loadstar) – Major port and landside congestion at US west coast ports could last until the summer peak season, according to ocean",https://gcaptain.com/u-s-west-coast-port-congestion-could-last-until-summer-peak-season/,"March 4, 2021"
Global Cargo Traffic Jam Could Last to 2022,"By Thomas Black (Bloomberg) — A cargo traffic jam on the world’s roads, seas and air corridors could easily continue into next year, continuing to",https://gcaptain.com/global-cargo-traffic-jam-could-last-to-2022/,"March 2, 2021"
Louisiana Offshore Oil Port Loadings Crash to Zero From Record,By Sheela Tobben (Bloomberg) — Crude exports from Louisiana’s offshore supertanker port tumbled to zero as Asian buyers limited purchases to manage,https://gcaptain.com/louisiana-offshore-oil-port-loadings-crash-to-zero-from-record/,"March 2, 2021"
U.S. Imports at Full Speed Show Uneven Global Recovery Pace,"By Brendan Murray (Bloomberg) — A surge of imports into the U.S. economy shows little sign of slowing down, clogging American ports and highlighting",https://gcaptain.com/u-s-imports-at-full-speed-show-uneven-global-recovery-pace/,"March 2, 2021"
U.S. Retailers See Millions in Sales Delays Amid Shipping Logjam,"By Kim Bhasin, Jordyn Holman and Henry Ren (Bloomberg) — Overwhelmed U.S. ports, elevated freight costs and accidents that sent goods plunging to the",https://gcaptain.com/u-s-retailers-see-millions-in-sales-delays-amid-shipping-logjam/,"February 26, 2021"
U.S. Imports Surge Set to Run Into Summer as West Coast Ports struggle,"By Mike Wackett (The Loadstar) – Container freight and charter markets are continuing to boom post-Chinese New Year, and analysts expect favourable",https://gcaptain.com/u-s-imports-surge-set-to-run-into-summer-as-west-coast-ports-struggle/,"February 23, 2021"
No LNG Carriers Loading at Texas Export Terminals,By Sergio Chapa and Michael Tobin (Bloomberg) — Right now there are no liquefied natural gas tankers docked and loading at any of the six U.S. export,https://gcaptain.com/no-lng-carriers-loading-at-texas-export-terminals/,"February 19, 2021"
U.S. Steps Up Heat on Container Carriers to Ease Port Congestion,"By Brendan Murray (Bloomberg) — U.S. regulators stepped up the heat on ocean shipping companies and the seaport terminals some of them operate, seeking",https://gcaptain.com/u-s-steps-up-heat-on-container-carriers-to-ease-port-congestion/,"February 18, 2021"
Port of Los Angeles Will Divert Ships to Battle Covid Container Congestion,"By Robert Tuttle (Bloomberg) The Port of Los Angeles plans to divert cargo ships to other destinations because of pandemic-fueled congestion, according to the",https://gcaptain.com/la-divert-ships-covid-container-congestion/,"February 18, 2021"
LNG Ship Sets Sail Despite Texas Order To Halt LNG Exports,Texas Governor orders halt of LNG exports as a massive winter storm cripples power plants in the region. It is unclear if the order pertains to all exports or,https://gcaptain.com/lng-ship-sets-sail-despite-texas-order-to-halt-lng-exports/,"February 17, 2021"
"A Rarity Among U.S. Ports, Seattle Still Has Room for More Ships","By Brendan Murray (Bloomberg) — The trade gateways in the U.S. Pacific Northwest that handle the flow of containers, cars and commodities are standing",https://gcaptain.com/a-rarity-among-u-s-ports-seattle-still-has-room-for-more-ships/,"February 17, 2021"
"A Rarity Among U.S. Ports, Seattle Still Has Room for More Ships","By Brendan Murray (Bloomberg) — The trade gateways in the U.S. Pacific Northwest that handle the flow of containers, cars and commodities are standing",https://gcaptain.com/a-rarity-among-u-s-ports-seattle-still-has-room-for-more-ships/,"February 17, 2021"
ITF Calls on Shipping Companies to Save Seafarers Stranded Off China,The International Transport Workers Federation (ITF) is calling on companies to step up efforts to help seafarers stranded on ships off China as Beijing,https://gcaptain.com/itf-calls-on-shipping-companies-to-save-seafarers-stranded-off-china/,"February 16, 2021"
America’s Largest Port Starts COVID-19 Vaccinations,"(gCaptain editorial note: Did I miss publishing the fucking news from ports about vaccinating mariners so they can go the fuck home? Admiral Schultz,",https://gcaptain.com/port-covid-19-vaccinations/,"February 16, 2021"
Combined Antwerp and Zeebrugge Port to Rival Rotterdam,By Gavin van Marle (The Loadstar) – A new superport is set to be created in north-west Europe after the Belgian ports of Antwerp,https://gcaptain.com/combined-antwerp-and-zeebrugge-port-to-rival-rotterdam/,"February 12, 2021"
A Light Bulb Moment for Port and Terminal Development,"By Rory McBride –  Future gazing is integral to the evolution of the shipping industry, with discussions on the terminal of tomorrow and fleet of the",https://gcaptain.com/a-light-bulb-moment-for-port-and-terminal-development/,"February 11, 2021"
Dockworkers at Nation’s Busiest Port Complex May Get Better Vaccine Access,"By Brendan Murray (Bloomberg) — Dockworkers at the busiest U.S. gateway for trade with Asia may soon have better access to coronavirus vaccines, as",https://gcaptain.com/dockworkers-at-nations-busiest-port-complex-may-get-better-vaccine-access/,"February 6, 2021"
U.S. Annual Trade Gap Grows to Biggest Since Financial Crisis,By Eric Martin (Bloomberg) — The U.S. last year posted its biggest annual trade deficit since 2008 as the global health crisis depressed export,https://gcaptain.com/u-s-annual-trade-gap-grows-to-biggest-since-financial-crisis/,"February 5, 2021"
Cargo Boom Continues at Nation’s Second-Busiest Port,The Port of Long Beach has reported its busiest January on record as the cargo boom continues into 2021. Dockworkers and terminal operators at the port moved,https://gcaptain.com/cargo-boom-continues-at-nations-second-busiest-port/,"February 4, 2021"
FMC Urges Biden Administration to Expedite Vaccinations for Nation’s Dockworkers,By Gavin van Marle (The Loadstar) – Federal Maritime Commissioners Carl Bentzel and Daniel Maffei have written to US president Joe Biden urging,https://gcaptain.com/fmc-urges-biden-administration-to-expedite-vaccinations-for-nations-dockworkers/,"February 1, 2021"
Frozen Fish Pileup in China Ripples Across Global Supply Chain,By Ann Koh (Bloomberg) — A huge pile up of fish cargoes at a Chinese port risks impacting shipments of frozen food across the country and beyond.,https://gcaptain.com/frozen-fish-pileup-in-china-ripples-across-global-supply-chain/,"January 26, 2021"
Anchored Containerships Off Los Angeles/Long Beach Flee Winter Storm,By Brendan Murray (Bloomberg) — Cargo ships enduring one of the worst U.S. port bottlenecks in more than a decade faced down another obstacle as they,https://gcaptain.com/anchored-containerships-off-los-angeles-long-beach-flee-winter-storm/,"January 26, 2021"
Great Lakes Sees Strong 2020 Navigation Season Despite COVID Headwinds,"Overall tonnage transported by ships in the binational Great Lakes-St. Lawrence Seaway system was down slightly in the 2020 navigation season compared to 2019,",https://gcaptain.com/great-lakes-sees-strong-2020-navigation-season-despite-covid-headwinds/,"January 19, 2021"
